{
  "id": "cs-mr01",
  "title": "CMEMS weather routing for a shipping line",
  "summary": "A shipping line integrated CMEMS ocean and wave forecasts into weather routing, cutting fuel use and emissions.",
  "narrative": "## Challenge\nAdverse currents and waves increased fuel consumption and emissions on long routes. Existing route planning could not fully exploit favourable conditions or reliably avoid costly weather.\n\n## Approach\nCMEMS forecasts of currents, waves, sea level and wind were integrated into the line's weather-routing system, optimising route and speed for each voyage.\n\n## Results\nThe line achieved measurable per-voyage fuel savings and corresponding emissions reductions, with improved schedule reliability across its main corridors.",
  "status": "published",
  "maturity": "operational",
  "classification": {
    "market_segments": [
      "transport.maritime"
    ],
    "products": [
      "cmems"
    ],
    "regions": [
      "North Atlantic & Mediterranean"
    ],
    "site": {
      "eu_project": false,
      "project_link": "https://marine.copernicus.eu"
    }
  },
  "tags": [],
  "relations": [
    {
      "type": "instantiates",
      "target": "uc-mr01",
      "target_kind": "use_case"
    }
  ],
  "stakeholders": [
    {
      "name": "Container shipping line (illustrative)"
    }
  ],
  "sources": [
    {
      "type": "derived",
      "reference": "Migrated from old casestudies/*.json content model"
    }
  ],
  "history": [
    {
      "timestamp": "2026-06-25T00:00:00Z",
      "author": "migration-script",
      "comment": "Migrated from old flat case-study schema (challenge/approach/results/user/location/real/link)."
    }
  ]
}
