{
  "id": "cs-rl03",
  "title": "Automated vegetation monitoring across a national network",
  "summary": "CLMS-derived canopy-change detection replaced manual line-side inspection across thousands of kilometres of rural corridor.",
  "narrative": "## Challenge\nMonitoring vegetation encroachment along 8,000 km of rural track via manual patrols was expensive, seasonal and inconsistent, contributing to recurring overhead-line contact incidents.\n\n## Approach\nAnnual CLMS tree-cover-density and vegetation-phenology products from Sentinel-2 were processed to detect canopy expansion within a corridor buffer. Change alerts above a density threshold triggered targeted inspection work orders.\n\n## Results\nIn the first year the system produced several hundred encroachment alerts, the large majority confirmed actionable on field verification. Reactive vegetation incidents fell substantially over two years, with significant annual inspection-cost savings.",
  "status": "published",
  "maturity": "operational",
  "classification": {
    "market_segments": [
      "transport.rail"
    ],
    "products": [
      "clms",
      "sentinel-2"
    ],
    "regions": [
      "Central Europe"
    ],
    "site": {
      "eu_project": false,
      "project_link": "https://land.copernicus.eu"
    }
  },
  "tags": [],
  "relations": [
    {
      "type": "instantiates",
      "target": "uc-rl03",
      "target_kind": "use_case"
    }
  ],
  "stakeholders": [
    {
      "name": "National infrastructure manager (illustrative)"
    }
  ],
  "sources": [
    {
      "type": "derived",
      "reference": "Migrated from old casestudies/*.json content model"
    }
  ],
  "history": [
    {
      "timestamp": "2026-06-25T00:00:00Z",
      "author": "migration-script",
      "comment": "Migrated from old flat case-study schema (challenge/approach/results/user/location/real/link)."
    }
  ]
}
